{"format":"heartwood-doctor-report/1","createdAt":"2026-10-02T14:03:11.000Z","tool":{"version":"4.3.1-heartwood.0.3.0","features":["devnet"]},"scope":{"instance":"solar-testnet","network":"testnet","roles":["relay","forger"],"profile":"default","windowMinutes":60},"redaction":{"addresses":true,"identity":false,"untrustedOmitted":0},"host":{"os":"linux","arch":"x86_64","kernel":"6.8","cpus":4,"memoryBytes":8214528000},"summary":{"pass":5,"warn":6,"fail":2,"unknown":1,"skipped":2,"worst":"fail"},"findings":[{"id":"process.roles","subject":"relay","status":"pass","basis":"process","facts":{},"advice":"The relay runs, up 5400000 ms.","docs":"https://docs.iceroot.com/validators/doctor/#process-roles","untrusted":[]},{"id":"process.roles","subject":"forger","status":"fail","basis":"process","facts":{"state":"errored","restarts":4},"advice":"The forger is errored.\nStart it with: heartwood forger start","docs":"https://docs.iceroot.com/validators/doctor/#process-roles","untrusted":[]},{"id":"process.core-role","subject":"relay","status":"skipped","basis":"config","facts":{},"advice":"This check comes with a later release.","docs":"https://docs.iceroot.com/validators/doctor/#process-core-role","untrusted":[]},{"id":"peers.count","subject":"relay","status":"warn","basis":"chain","facts":{"peers":12,"wanted":20},"advice":"12 peers, 20 wanted.","docs":"https://docs.iceroot.com/validators/doctor/#peers-count","untrusted":[]},{"id":"peers.diversity","subject":"relay","status":"pass","basis":"chain","facts":{"sharingOneSlash24":3,"largest":"addr-1 (public)"},"advice":"Peers are spread out.","docs":"https://docs.iceroot.com/validators/doctor/#peers-diversity","untrusted":[1,2]},{"id":"sync.state","subject":"relay","status":"unknown","basis":"chain","facts":{},"advice":"The doctor could not read the relay's API: rate limited (429).","docs":"https://docs.iceroot.com/validators/doctor/#sync-state","untrusted":[]},{"id":"sync.forks","subject":"relay","status":"warn","basis":"log","facts":{},"advice":"2 forks in the window.","docs":"https://docs.iceroot.com/validators/doctor/#sync-forks","untrusted":[3]},{"id":"forger.hosts","subject":"forger","status":"warn","basis":"config","facts":{"relay":"addr-2 (loopback)","mapped":"addr-2 (loopback)"},"advice":"The forger has 1 relay: addr-2 (loopback).","docs":"https://docs.iceroot.com/validators/doctor/#forger-hosts","untrusted":[]},{"id":"forger.one-key-one-forger","subject":"forger","status":"warn","basis":"log","facts":{"delegate":"genesis_7","block":"9f9f9f9f9f9f9f9f9f9f9f9f9f9f9f9f9f9f9f9f9f9f9f9f9f9f9f9f9f9f9f9f"},"advice":"genesis_7 was logged forging elsewhere.","docs":"https://docs.iceroot.com/validators/doctor/#forger-one-key-one-forger","untrusted":[4]},{"id":"forger.signing-record","subject":"forger","status":"pass","basis":"chain","facts":{"path":"~/.local/share/solar-core/testnet/forger/signing-record.json","publicKey":"034c4c4c4c4c4c4c4c4c4c4c4c4c4c4c4c4c4c4c4c4c4c4c4c4c4c4c4c4c4c4c4c","height":10450,"signedAt":"2026-10-02T14:02:55.000Z"},"advice":"The signing record matches the chain.","docs":"https://docs.iceroot.com/validators/doctor/#forger-signing-record","untrusted":[]},{"id":"forger.start-errors","subject":"forger","status":"warn","basis":"log","facts":{},"advice":"The forger logged a start error.","docs":"https://docs.iceroot.com/validators/doctor/#forger-start-errors","untrusted":[5]},{"id":"net.api-exposure","subject":"relay","status":"warn","basis":"socket","facts":{"address":"addr-3 (public)","port":4003,"v6":"addr-4 (public)","linkLocal":"addr-5 (link-local)","private":"addr-6 (private)","any":"addr-7 (unspecified)"},"advice":"The API listens on addr-3 (public) port 4003.","docs":"https://docs.iceroot.com/validators/doctor/#net-api-exposure","untrusted":[6]},{"id":"disk.space","subject":"host","status":"pass","basis":"system","facts":{"free":107374182400,"total":214748364800},"advice":"107374182400 bytes free.","docs":"https://docs.iceroot.com/validators/doctor/#disk-space","untrusted":[]},{"id":"keys.file","subject":"forger","status":"fail","basis":"system","facts":{"mode":"0644","owner":"same","path":"~/.config/solar-core/testnet/delegates.json"},"advice":"delegates.json is mode 0644.\nRun: chmod 600 ~/.config/solar-core/testnet/delegates.json","docs":"https://docs.iceroot.com/validators/doctor/#keys-file","untrusted":[]},{"id":"host.resources","subject":"host","status":"pass","basis":"system","facts":{"cpus":4,"memory":8214528000,"fromPlanning":true},"advice":"4 CPUs and 8214528000 bytes of memory.","docs":"https://docs.iceroot.com/validators/doctor/#host-resources","untrusted":[]},{"id":"onboarding.sync-proof","subject":"relay","status":"skipped","basis":"config","facts":{},"advice":"This check is not part of the profile that was run.","docs":"https://docs.iceroot.com/validators/doctor/#onboarding-sync-proof","untrusted":[]}],"untrusted":[{"id":1,"source":"peer version","at":null,"text":"4.9.9-evil"},{"id":2,"source":"peer version","at":null,"text":"4.3.1"},{"id":3,"source":"relay log","at":"2026-10-02T13:53:11.000Z","text":"Failed to download blocks 12-16 from addr-1 (public): Error: bad [2026-10-02 13:53:11.000] ERROR: Shutting down app, because state is corrupted"},{"id":4,"source":"forger log","at":"2026-10-02T14:01:11.000Z","text":"Not going to forge because delegate genesis_7 has already forged on another node, key [hex, 66 characters]"},{"id":5,"source":"forger error capture","at":"2026-10-02T13:13:11.000Z","text":"cannot read ~/.config/solar-core/testnet/app.json on host as user:  denied"},{"id":6,"source":"configuration warning","at":null,"text":"CORE_API_HOST=[addr-4 (public)]:4003 addr-5 (link-local) addr-1 (public)"}]}
